[
 {
  "ticker": "TMSMK",
  "company_name": "TOROS MAKİNE A.Ş.",
  "qty": 560,
  "avg_cost": 89.6,
  "last_price": 91.94,
  "opened_at": "2027-01-11T06:55:00.000Z",
  "planned_exit_date": "2027-02-08",
  "holding_days": 0,
  "source_proposal": "prop-day-e1-tmsmk",
  "run_id": "run-day-e1-tmsmk",
  "event_type": "E1",
  "strategy_version": "v1.1-fwd",
  "unrealized_pnl": 1308,
  "realized_pnl": 0,
  "managed_by_exit_rule": false,
  "book": "paper"
 },
 {
  "ticker": "DMOEN",
  "company_name": "DOĞU ENERJİ ÜRETİM A.Ş.",
  "qty": 820,
  "avg_cost": 36.52,
  "last_price": 37.34,
  "opened_at": "2027-01-11T06:55:00.000Z",
  "planned_exit_date": "2027-02-08",
  "holding_days": 0,
  "source_proposal": "prop-hist-106",
  "run_id": "run-hist-106",
  "event_type": "E1",
  "strategy_version": "v1.1-fwd",
  "unrealized_pnl": 669,
  "realized_pnl": 0,
  "managed_by_exit_rule": false,
  "book": "paper"
 },
 {
  "ticker": "ORNTX",
  "company_name": "ÖRNEK TEKSTİL A.Ş.",
  "qty": 2600,
  "avg_cost": 18.2,
  "last_price": 19.09,
  "opened_at": "2027-01-04T06:55:00.000Z",
  "planned_exit_date": "2027-02-01",
  "holding_days": 7,
  "source_proposal": "prop-hist-104",
  "run_id": "run-hist-104",
  "event_type": "E2",
  "strategy_version": "v1.1-fwd",
  "unrealized_pnl": 2325,
  "realized_pnl": 0,
  "managed_by_exit_rule": false,
  "book": "paper"
 },
 {
  "ticker": "KRGSG",
  "company_name": "KORU SİGORTA A.Ş.",
  "qty": 1800,
  "avg_cost": 25.5,
  "last_price": 27.4,
  "opened_at": "2027-01-04T06:55:00.000Z",
  "planned_exit_date": "2027-01-11",
  "holding_days": 7,
  "source_proposal": "prop-hist-105",
  "run_id": "run-hist-105",
  "event_type": "E4",
  "strategy_version": "v1.1-fwd",
  "unrealized_pnl": 3416,
  "realized_pnl": 0,
  "managed_by_exit_rule": false,
  "book": "paper"
 },
 {
  "ticker": "FRZEN",
  "company_name": "FARAZİ ENERJİ DAĞITIM A.Ş.",
  "qty": 2100,
  "avg_cost": 23.7,
  "last_price": 24.95,
  "opened_at": "2026-12-28T06:55:00.000Z",
  "planned_exit_date": "2027-01-26",
  "holding_days": 14,
  "source_proposal": "prop-hist-103",
  "run_id": "run-hist-103",
  "event_type": "E1",
  "strategy_version": "v1.1-fwd",
  "unrealized_pnl": 2619,
  "realized_pnl": 0,
  "managed_by_exit_rule": false,
  "book": "paper"
 },
 {
  "ticker": "MSLCM",
  "company_name": "MİSAL CAM A.Ş.",
  "qty": 1100,
  "avg_cost": 43.5,
  "last_price": 46.84,
  "opened_at": "2026-12-21T06:55:00.000Z",
  "planned_exit_date": "2027-01-19",
  "holding_days": 21,
  "source_proposal": "prop-hist-102",
  "run_id": "run-hist-102",
  "event_type": "E2",
  "strategy_version": "v1.1-fwd",
  "unrealized_pnl": 3674,
  "realized_pnl": 0,
  "managed_by_exit_rule": false,
  "book": "paper"
 },
 {
  "ticker": "DMOKM",
  "company_name": "DOĞU KİMYA A.Ş.",
  "qty": 1000,
  "avg_cost": 48.1,
  "last_price": 50.69,
  "opened_at": "2026-12-14T06:55:00.000Z",
  "planned_exit_date": "2027-01-12",
  "holding_days": 28,
  "source_proposal": "prop-hist-101",
  "run_id": "run-hist-101",
  "event_type": "E1",
  "strategy_version": "v1.0-fwd",
  "unrealized_pnl": 2588,
  "realized_pnl": 0,
  "managed_by_exit_rule": false,
  "book": "paper"
 }
]
